{
  "access_token": "eyJhbGciOi...redacted",
  "token_type": "Bearer",
  "expires_in": 900,
  "refresh_token": "rt_redacted_optional",
  "session": {
    "id": "ses_example_001",
    "issued_at": "2026-08-17T10:00:00Z",
    "expires_at": "2026-08-17T18:00:00Z"
  },
  "user": {
    "id": "usr_example_001",
    "google_sub": "110000000000000000000",
    "email": "person@example.invalid",
    "email_verified": true,
    "hd": "example.invalid",
    "display_name": "Example Person"
  },
  "tool": {
    "slug": "template-project",
    "display_name": "Template Project"
  },
  "grant": {
    "role": "tool_user",
    "permissions": [
      "template-project:example:read"
    ]
  },
  "correlation_id": "corr_legacy_example_001"
}
